story_id,category,claim,evidence,infer,support,comments
10,Plot,"The author structures the narrative with a focus on the protagonist's internal and external conflicts, creating a layered and complex storyline.","In the story regarding ""the story of 'The Executioner' as the last resort,"" the protagonist reflects on their role and the fear they instill in others, while simultaneously preparing for a mission against a formidable opponent, Kane, highlighting both internal and external conflicts.",,,
10,Creativity,The author integrates supernatural elements to enhance the narrative's tension and depth.,"In the story regarding ""the story of 'The Executioner' as the last resort,"" the protagonist possesses abilities such as making heads explode and manipulating electrical systems, which are used strategically during the mission against Kane.",,,
10,Development (Character and Setting),"The author develops the protagonist as a multidimensional character, exploring their psychological state and moral ambiguity.","In the story regarding ""the story of 'The Executioner' as the last resort,"" the protagonist acknowledges the fear they evoke and the pleasure they derive from their work, yet they also express a sense of duty and professionalism, creating a complex character profile.",,,
10,Development (Character and Setting),The author establishes an immersive setting that reflects the protagonist's dark and dangerous world.,"In the story regarding ""the story of 'The Executioner' as the last resort,"" the setting of Kane's compound, with its darkened hallways and panicking guards, mirrors the protagonist's lethal and shadowy existence.",,,
10,Language Use,The author employs vivid and precise language to create an intense and immersive atmosphere.,"In the story regarding ""the story of 'The Executioner' as the last resort,"" phrases like ""Bullets through eyes, a trail of bodies"" and ""the floor is already slick with blood"" vividly depict the violence and tension of the protagonist's mission.",,,
10,Language Use,The author uses a first-person narrative perspective to provide insight into the protagonist's thoughts and emotions.,"In the story regarding ""the story of 'The Executioner' as the last resort,"" the use of first-person narration allows the reader to experience the protagonist's internal monologue, such as their reflections on fear and the nature of their work.",,,
3,Creativity,The author integrates a science fiction setting to reinterpret the traditional genie mythos.,"In the story regarding ""the last wish in the world granted by a genie,"" the genies are part of an ""enlightened civilization that spanned the galaxy,"" and the narrative includes elements like ""the occasional ship streak across the sky,"" blending futuristic elements with the classic genie lore.",,,
3,Development (Character and Setting),The author develops the genie as a multidimensional character with a personal narrative arc.,"In the story regarding ""the last wish in the world granted by a genie,"" the genie expresses personal desires and reflections, such as, ""I have a personality and a will of my own, but to change anything, I must be fulfilling the wish of a mortal.""",,,
3,Development (Character and Setting),The author creates an immersive setting that reflects the themes of decay and renewal.,"In the story regarding ""the last wish in the world granted by a genie,"" the setting is described with vivid imagery, such as ""great works of architecture are being reclaimed by nature,"" emphasizing the theme of a civilization in decline.",,,
3,Language Use,The author employs reflective and philosophical language to convey the genie's introspection.,"In the story regarding ""the last wish in the world granted by a genie,"" the genie muses, ""There is beauty in it, this age of fading glory. The universe will move on, no matter from what height intelligent beings have fallen.""",,,
3,Language Use,The author uses detailed and evocative descriptions to enhance the narrative's emotional depth.,"In the story regarding ""the last wish in the world granted by a genie,"" the genie's actions are described with sensory detail, such as ""I draw detailed pictures in the sand of beaches, and watch the waves erase them,"" highlighting the transient nature of existence.",,,
9,Plot,The author structures the narrative around introspection and acceptance of fate.,"In the story regarding ""those left behind on a dying Earth,"" the protagonist reflects, ""I was always going to die, even if I made it on The Ark. My trajectory is decidedly less exciting, but the end point has not changed.""",,,
9,Creativity,The author integrates philosophical exploration and artistic creation as a response to existential despair.,"In the story regarding ""those left behind on a dying Earth,"" the protagonist turns to philosophy and art, stating, ""I begin reading philosophy, particularly those in the past who have mused on death and what constitutes a life worth living... I realize that there is a deeply rooted desire inside me to create.""",,,
9,Development (Character and Setting),The author develops the protagonist's character through their emotional journey and search for meaning.,"In the story regarding ""those left behind on a dying Earth,"" the protagonist evolves from despair to finding solace in creation, noting, ""I find the acute sadness brings out emotions, and that expressing them results in creations I am proud of.""",,,
9,Language Use,The author employs reflective and contemplative language to convey the protagonist's inner journey.,"In the story regarding ""those left behind on a dying Earth,"" the language is introspective, as seen in, ""What could I do that would have meaning? I begin reading philosophy... I realize that there is a deeply rooted desire inside me to create.""",,,
