source,category,claim,coherence,consistency,comments
7,Plot,"The user effectively balances humor with tension, creating engaging narratives that blend humor with suspenseful or high-tension scenes.",,,
7,Creativity,"The user employs a high level of creativity through the integration of humor and irony, particularly in depicting unlikely scenarios, such as humorous takes on serious transformations, enhancing narrative depth.",,,
7,Creativity,"Symbolic imagery and unexpected twists, such as imaginative portrayals of transformations and interactions with supernatural elements, add complexity and engagement to the narrative.",,,
7,Development (Character and Setting),"The user vividly describes settings that play a crucial role in the narrative, such as everyday locations that contribute to the story's tone, enhancing the comedic or dramatic atmosphere.",,,
10,Plot,"The user incorporates significant plot twists, such as dual identities, to add depth and complexity to the narrative.",,,
10,Creativity,"The user showcases imaginative and visual creativity through character transformations and unexpected narrative developments, such as human brain integration and memory recovery.",,,
10,Development (Character and Setting),"Multidimensional characters are presented, displaying a mix of authority, regret, and vulnerability, enhancing the emotional arcs and depth of the narrative.",,,
10,Language Use,"The pacing is well-balanced, with moments of tension and introspection interspersed to maintain reader engagement.",,,
4,Plot,"The user crafts character-driven plots that often involve personal and emotional journeys, with resolutions that focus on internal transformation and emotional catharsis.",,,
4,Language Use,"The user employs descriptive language and natural dialogue to create vivid and immersive narratives, effectively conveying characters' emotions and enhancing storytelling.",,,
4,Language Use,"The tone is adaptable, ranging from playful and humorous to somber and hopeful, with the use of metaphors and imagery enhancing thematic elements.",,,
