story_id,category,claim,example,coherence,grounding,evidence,comments
10,Plot,The author tends to create a complex plot structure that intertwines action with psychological depth.,"In the story regarding ""the Executioner as the last resort,"" the protagonist not only engages in a physical battle with Kane but also grapples with the moral implications of their role, reflecting on the fear they instill and the pleasure they derive from their work.",,,,
10,Creativity,The author often incorporates unique abilities and imaginative elements to enhance the narrative.,"In the story regarding ""the Executioner as the last resort,"" the protagonist possesses the ability to overload electrical systems and make heads explode, adding a supernatural dimension to the otherwise grounded action narrative.",,,,
10,Development (Character and Setting),The author develops characters by exploring their internal conflicts and motivations.,"In the story regarding ""the Executioner as the last resort,"" the protagonist reflects on their role and the fear they inspire, as well as the moral complexities of their actions, providing insight into their character beyond their physical prowess.",,,,
10,Development (Character and Setting),The author creates immersive settings that reflect the story's tone and themes.,"In the story regarding ""the Executioner as the last resort,"" the setting of Kane's compound, with its darkened hallways and panicking guards, mirrors the protagonist's shadowy and lethal nature, enhancing the tension and atmosphere.",,,,
10,Language Use,The author uses vivid and precise language to convey action and emotion.,"In the story regarding ""the Executioner as the last resort,"" phrases like ""bullets through eyes, a trail of bodies"" and ""the floor is already slick with blood"" vividly depict the intensity and brutality of the protagonist's mission.",,,,
10,Language Use,The author employs a first-person narrative to create an intimate connection with the protagonist's perspective.,"In the story regarding ""the Executioner as the last resort,"" the use of first-person narration allows readers to experience the protagonist's thoughts and emotions directly, such as when they consider the fear they instill in others and the satisfaction they derive from their work.",,,,
9,Plot,"The author often structures narratives with a reflective and philosophical tone, focusing on the internal experiences of characters and existential themes.","In the story of those left behind as humanity departs Earth, the protagonist reflects on their rejection from The Ark and turns to philosophy and creative pursuits to find meaning in their remaining time.",,,,
9,Creativity,"The author tends to reinterpret prompts with a grand, philosophical scope, often involving cosmic or existential themes.","In the story of those left behind as humanity departs Earth, the protagonist delves into philosophical texts and explores different schools of thought, such as nihilism and absurdism, to understand what constitutes a life worth living.",,,,
9,Development (Character and Setting),"The author develops characters through introspection and existential themes, often focusing on their internal conflicts and psychological responses to overwhelming threats.","In the story of those left behind as humanity departs Earth, the protagonist undergoes a journey of self-discovery, finding solace in creative expression and forming connections with others who share their fate.",,,,
9,Language Use,"The author employs a reflective and philosophical tone, using introspective language to convey deep thematic elements.","In the story of those left behind as humanity departs Earth, the author writes, ""I realize that there is a deeply rooted desire inside me to create. To write, to draw, to paint, to compose,"" illustrating the protagonist's introspective realization and emotional depth.",,,,
4,Plot,"The author often structures narratives around complex political and economic negotiations, highlighting the intricacies and potential pitfalls of decision-making.","In the story regarding ""aliens proposing to build a Dyson sphere around our sun,"" the narrative centers on the UN Security Council's prolonged debates and the geopolitical maneuvering involved in deciding whether to sell the sun's energy rights.",,,,
4,Creativity,"The author tends to reinterpret prompts by introducing elements of skepticism and critique of human nature, particularly in the context of interstellar interactions.","In the story regarding ""aliens proposing to build a Dyson sphere around our sun,"" the author introduces a galactic arbiter who reveals that the aliens' offer was exploitative, critiquing the human tendency to be swayed by seemingly advantageous deals without understanding their true value.",,,,
4,Development (Character and Setting),"The author develops settings that emphasize the vastness and complexity of interstellar societies, often using them to reflect on human societal structures.","In the story regarding ""aliens proposing to build a Dyson sphere around our sun,"" the arrival of multiple alien species after the initial proposal creates a setting that mirrors the diversity and complexity of galactic society, highlighting the potential for both exploitation and collaboration.",,,,
4,Language Use,"The author frequently employs a tone of irony and skepticism, using language that underscores the disparity between human expectations and reality.","In the story regarding ""aliens proposing to build a Dyson sphere around our sun,"" phrases like ""first contact is here, and it is a... business proposition"" and the arbiter's laughter at the humans' naivety convey a tone of irony and critique of human assumptions about alien intentions.",,,,
