story_id,category,claim,evidence,infer,support,comments
10,Plot,The author structures the narrative around internal conflict and identity crisis.,"In the story regarding ""human weapons grappling with identity,"" Era questions its own existence and purpose, saying, ""Why? Why can I think? I don’t like this? I don’t like thinking. Everything hurts, I’m scared.""",,,
10,Creativity,The author creatively integrates elements of psychological horror and existential dread.,"In the story regarding ""human weapons grappling with identity,"" the author describes Era's internal struggle with its programming and memories, creating a sense of horror as it realizes, ""There isn’t even a full brain in your thick skull anymore. All that’s left is a machine.""",,,
10,Development (Character and Setting),The author develops characters through their emotional and psychological depth.,"In the story regarding ""human weapons grappling with identity,"" Era's character is explored through its emotional turmoil and memories, as it asserts, ""I’M NOT ERA. I’m Nick. We know each other. Don’t we?""",,,
10,Development (Character and Setting),The author establishes a setting that reflects the characters' internal states.,"In the story regarding ""human weapons grappling with identity,"" the setting of a bombed laboratory mirrors Era's fragmented sense of self, described as ""leaving nothing but scorched land, a few desks and the remnants of glass and tubes.""",,,
10,Language Use,The author employs vivid and unsettling imagery to convey the protagonist's internal conflict.,"In the story regarding ""human weapons grappling with identity,"" the author uses phrases like ""memories were flooding into its mind, drowning out that robotic side"" to illustrate Era's struggle with its identity.",,,
10,Language Use,The author uses dialogue to reveal character dynamics and power struggles.,"In the story regarding ""human weapons grappling with identity,"" the dialogue between Gabby and Era, such as ""You’re nothing but a gun. Now stop jamming and fire,"" highlights the tension and control exerted by Gabby over Era.",,,
9,Plot,"The author structures the plot around character interactions and comedic misunderstandings, leading to unexpected resolutions.","In the story regarding ""talking mimics and adventurers,"" Jeremy's interaction with the mimic begins with a comical situation where his hand is stuck in the mimic's mouth, leading to a humorous dialogue about the mimic's choice of disguise and ending with the mimic finding peace in solitude.",,,
9,Creativity,The author creatively explores the mimic's ability to transform and its implications.,"In the story regarding ""talking mimics and adventurers,"" the mimic considers various forms it could take, such as a lamp or a statue, and eventually transforms into a human-like figure, showcasing the author's imaginative take on the mimic's transformative abilities.",,,
9,Development (Character and Setting),"The author develops characters through witty dialogue and distinct personalities, creating a vivid sense of their relationship.","In the story regarding ""talking mimics and adventurers,"" Jeremy and the mimic engage in a back-and-forth exchange about the mimic's potential disguises, revealing their personalities and creating a dynamic interaction that develops both characters.",,,
9,Language Use,The author uses playful and informal language to establish a comedic and light-hearted tone.,"In the story regarding ""talking mimics and adventurers,"" phrases like ""I’m not some freak that wants people sitting on them!"" and ""I hope someone tries to lock pick you"" contribute to a playful and humorous tone throughout the narrative.",,,
2,Plot,The author structures the plot around political intrigue and betrayal rather than a straightforward siege.,"In the story regarding ""a lone defender in a castle against an entire army,"" the narrative reveals that the siege is a cover for a conspiracy among the lords to overthrow the king, with Grethon's surrender being part of a larger plan to assassinate the king.",,,
2,Creativity,The author creatively reinterprets the prompt by focusing on the moral and ethical dilemmas faced by the characters.,"In the story regarding ""a lone defender in a castle against an entire army,"" the author explores the king's moral corruption and the knight Marcus's internal conflict about his loyalty and the king's unjust actions against Grethon, who committed no actual crime.",,,
2,Development (Character and Setting),The author develops characters through their internal conflicts and moral choices.,"In the story regarding ""a lone defender in a castle against an entire army,"" Marcus is portrayed as a conflicted character, questioning the king's morality and his own loyalty, especially after realizing the king's actions are driven by personal vendettas rather than justice.",,,
2,Language Use,The author uses descriptive language to convey the emotional and psychological states of the characters.,"In the story regarding ""a lone defender in a castle against an entire army,"" the author describes King Salas's smirk as ""those dry lips at risk of chipping,"" which vividly conveys his sinister satisfaction and the decay of his character.",,,
