source,category,claim,example,coherence,groundedness,evidence,comments
2,Plot,The user tends to focus on character-driven narratives and internal conflicts rather than external events.,"In the story regarding ""a man feeling unmoored on the longest night of the year,"" the protagonist's struggle with the loss of his mother and his sense of disconnection is central to the narrative, with the solstice serving as a backdrop to his emotional journey.",,,,
2,Creativity,"The user frequently employs metaphor and symbolism, using vivid imagery to convey deeper themes.","In the story regarding ""a man feeling unmoored on the longest night of the year,"" the user describes the solstice as ""the year’s turning"" and ""the blink of a great eye,"" using metaphor to emphasize the protagonist's sense of time and change.",,,,
2,Development (Character and Setting),The user creates immersive settings by integrating the environment into the protagonist's emotional state.,"In the story regarding ""a man feeling unmoored on the longest night of the year,"" the setting of the multi-story car park and the drive home through Dublin are described in detail, mirroring the protagonist's feelings of being lost and unmoored.",,,,
2,Language Use,The user employs descriptive and evocative language to enhance the narrative's emotional depth.,"In the story regarding ""a man feeling unmoored on the longest night of the year,"" phrases like ""the black concrete angles of the car-park roof gave way to the night sky"" and ""the earth spins them toward morning"" evoke a sense of vastness and introspection.",,,,
3,Plot,"The user often employs a realistic and immediate approach to plot development, focusing on the protagonist's tangible experiences and immediate concerns.","In the story of being stranded in an unfamiliar airport, the protagonist is preoccupied with practical issues like the time of her next flight and finding a hotel, as seen in her calculations about needing to be back at the airport in four hours.",,,,
3,Creativity,"The user tends to reinterpret prompts with a focus on realism and psychological tension, rather than abstract or philosophical themes.","In the story of being stranded in an unfamiliar airport, the user creates tension through the protagonist's fear and confusion about her surroundings, such as when she encounters soldiers and is unsure of her location.",,,,
3,Development (Character and Setting),"The user often develops characters through internal monologue and detailed observations, creating a vivid sense of the protagonist's mental state.","In the story of being stranded in an unfamiliar airport, the protagonist's thoughts reveal her frustration and anxiety, particularly when she reflects on her cancelled flight and the absence of familiar signs.",,,,
3,Language Use,"The user employs a stream-of-consciousness style to convey the protagonist's thoughts and emotions, creating an immersive narrative experience.","In the story of being stranded in an unfamiliar airport, the narrative flows with the protagonist's internal dialogue, such as when she repeatedly says ""O.K., O.K., O.K."" under her breath as she navigates the airport.",,,,
