story_id,category,claim,evidence,infer,support,comments
1,Plot,"The author structures the narrative around the protagonist's internal and external life changes, with the escalators as a backdrop.","In the story regarding ""a mysterious pair of escalators in a department store causing life changes for Kitty,"" the narrative explores Kitty's interactions with her family, her unexpected pregnancy, and her reflections on life changes, with the escalators serving as a backdrop rather than the central plot device.",,,
1,Creativity,The author integrates imaginative elements by using the escalators as a metaphor for life's unpredictability and change.,"In the story regarding ""a mysterious pair of escalators in a department store causing life changes for Kitty,"" the escalators are described as ""beautiful, and they never stopped,"" symbolizing the continuous and unpredictable nature of life, rather than being a mystical or magical element.",,,
1,Development (Character and Setting),The author develops multidimensional characters by focusing on their personal histories and emotional complexities.,"In the story regarding ""a mysterious pair of escalators in a department store causing life changes for Kitty,"" Kitty's character is explored through her reflections on her past relationships, her sons, and her unexpected pregnancy, providing depth to her emotional and personal journey.",,,
1,Development (Character and Setting),The author establishes an immersive setting by detailing the department store environment and its impact on the protagonist's life.,"In the story regarding ""a mysterious pair of escalators in a department store causing life changes for Kitty,"" the department store is depicted with vivid details, such as ""the hummocky slabs of mattress, the headboards like tombstones,"" creating a tangible backdrop for Kitty's experiences.",,,
1,Language Use,The author employs descriptive language to convey the protagonist's emotional state and the atmosphere of the setting.,"In the story regarding ""a mysterious pair of escalators in a department store causing life changes for Kitty,"" phrases like ""the steps tugged lightly at each other as they passed, snagging and loosening all day long"" illustrate the escalators' presence and Kitty's mixed feelings of balance and dizziness.",,,
1,Language Use,The author uses a reflective and introspective tone to explore the protagonist's inner thoughts and feelings.,"In the story regarding ""a mysterious pair of escalators in a department store causing life changes for Kitty,"" Kitty's introspection is evident when she considers her life changes, pondering, ""Her life was changing, that was for sure, though she seemed to be standing still. But up or down? she wondered. Up or down?""",,,
