story_id,category,claim,evidence,infer,support,comments
1,Plot,The author structures the narrative with a focus on character introductions and their motivations.,"In the story regarding ""a magnate's mysterious mansion gathering,"" the author introduces characters like Bella Welmer, Lizzy Harkness, and Mr. Smiddy, detailing their backgrounds and reasons for attending the gathering, such as Bella's transformation from a ""legacy hunter"" to someone who ""truly love[d] John Harmen.""",,,
1,Creativity,The author creatively reinterprets the prompt by focusing on the personal histories and dynamics among the characters rather than the mansion's mysteries.,"In the story regarding ""a magnate's mysterious mansion gathering,"" the narrative delves into the personal histories and relationships, such as Lizzy's respect for her father and Mr. Preston's educational role, rather than emphasizing the mansion's secrets or supernatural elements.",,,
1,Development (Character and Setting),The author develops characters through detailed backstories and interpersonal relationships.,"In the story regarding ""a magnate's mysterious mansion gathering,"" characters like Bella and Lizzy are given depth through their past actions and current motivations, such as Bella's admission of her ""mercenary wishes"" and Lizzy's mourning for her father.",,,
1,Development (Character and Setting),The setting is established through historical context and social dynamics rather than physical description.,"In the story regarding ""a magnate's mysterious mansion gathering,"" the setting is grounded in the historical context of 1934 and the social dynamics of the characters, such as the mention of the economic disaster and the societal roles of the guests.",,,
1,Language Use,The author employs a formal and descriptive language style to convey character insights and historical context.,"In the story regarding ""a magnate's mysterious mansion gathering,"" the author uses formal language, as seen in phrases like ""a man who was one of the least corruptible people Harmen had ever known,"" to provide insights into character traits and the historical setting.",,,
