story_id,category,claim,evidence,infer,support,comments
1,Plot,The author structures the narrative with a focus on character introductions and their motivations.,"In the story regarding ""a magnate's mysterious mansion gathering,"" the author introduces characters like Bella Welmer, Lizzy Harkness, and Mr. Smiddy, detailing their backgrounds and reasons for attending the gathering, such as Bella's transformation from a ""legacy hunter"" to someone who ""truly love[d] John Harmen.""",,,
1,Creativity,The author creatively reinterprets the prompt by focusing on the personal histories and dynamics among the characters rather than the mansion's mysteries.,"In the story regarding ""a magnate's mysterious mansion gathering,"" the narrative delves into the personal histories and relationships, such as Lizzy's respect for her father and Mr. Preston's educational role, rather than emphasizing the mansion's secrets or supernatural elements.",,,
1,Development (Character and Setting),The author develops characters through detailed backstories and interpersonal relationships.,"In the story regarding ""a magnate's mysterious mansion gathering,"" characters like Bella and Lizzy are given depth through their past actions and current motivations, such as Bella's admission of her ""mercenary wishes"" and Lizzy's mourning for her father.",,,
1,Development (Character and Setting),The setting is established through historical context and social dynamics rather than physical description.,"In the story regarding ""a magnate's mysterious mansion gathering,"" the setting is grounded in the historical context of 1934 and the social dynamics of the characters, such as the mention of the economic disaster and the societal roles of the guests.",,,
1,Language Use,The author employs a formal and descriptive language style to convey character insights and historical context.,"In the story regarding ""a magnate's mysterious mansion gathering,"" the author uses formal language, as seen in phrases like ""a man who was one of the least corruptible people Harmen had ever known,"" to provide insights into character traits and the historical setting.",,,
4,Plot,The author structures the narrative around the hunters' interactions with the townspeople and their precarious position within the city.,"In the story regarding ""hunters and titans in a northern city,"" the author writes, ""if something didnt happen soon, they were probably going to be expelled from the town, it wasnt safe to have beacons around, and hunters, two of them no less, were even worse.""",,,
4,Creativity,"The author integrates unique world-building elements, such as the ceramic fortresses and the role of surgeons, to enrich the narrative.","In the story regarding ""hunters and titans in a northern city,"" the author describes, ""homes were build like little stone fortresses, or rather, little ceramic fortresses as many of the chimneys had ceramic tiles about them, to make sure they retained the escaping heat from inner fires.""",,,
4,Development (Character and Setting),"The author develops the setting with detailed descriptions of the city's architecture and climate, creating a vivid backdrop for the story.","In the story regarding ""hunters and titans in a northern city,"" the author notes, ""Shlossheim was one of the Northernmost cities in the known world. It had longer winters than almost anywhere else.""",,,
4,Development (Character and Setting),"The author emphasizes the hunters' relationship with the surgeons, highlighting the tension and necessity of their presence.","In the story regarding ""hunters and titans in a northern city,"" the author writes, ""Hamon had been told he had to deal with only one wraith, so the fact that he was dealing with two hunters definitely surprised him.""",,,
4,Language Use,The author uses descriptive language to convey the harshness of the environment and the tension within the city.,"In the story regarding ""hunters and titans in a northern city,"" the author describes, ""Titans carved out enormous territories, and yet the many beasts of the colder North did not go anywhere near this city.""",,,
5,Plot,The author structures the narrative around a detailed magical ritual and its abrupt disruption.,"In the story regarding ""a magical ritual on Alcatraz disrupted by otherworldly beings,"" the author describes the Danelon Magi's preparation and execution of a large-scale magical gathering, detailing the ritual's progression until it is interrupted by the arrival of two otherworldly beings, leading to chaos and the scattering of corrupted magic.",,,
5,Creativity,The author integrates unique magical elements and societal dynamics into the narrative.,"In the story regarding ""a magical ritual on Alcatraz disrupted by otherworldly beings,"" the author introduces the Danelon Magi, a society with internal grudges and ambitions, and describes their use of ""Anchors"" to manage the energy flow, adding depth to the magical society's operations and conflicts.",,,
5,Development (Character and Setting),The author develops characters through their ambitions and roles within the magical society.,"In the story regarding ""a magical ritual on Alcatraz disrupted by otherworldly beings,"" characters like Ralph Bach and Alie Haiden are portrayed through their personal ambitions and contributions to the ritual, such as Ralph's desire for glory and Alie's scholarly pursuit of developing the ""invisible fire.""",,,
5,Development (Character and Setting),The author establishes an immersive setting by detailing the ritual's location and atmosphere.,"In the story regarding ""a magical ritual on Alcatraz disrupted by otherworldly beings,"" the author describes Alcatraz Island's transformation from a prison to a magical site, with ""a curtain of glowing colors"" and the ""music of a doorway,"" creating a vivid and mystical atmosphere.",,,
5,Language Use,The author employs vivid imagery and sensory details to enhance the magical atmosphere.,"In the story regarding ""a magical ritual on Alcatraz disrupted by otherworldly beings,"" the author uses phrases like ""a curtain of glowing colors formed"" and ""the glistening curtain tingled like a chime on a summer day porch,"" providing a rich sensory experience.",,,
