story_id,category,claim,example,coherence,grounding,evidence,comments
10,Plot,"The author structures stories around intimate and playful interactions, using these moments to explore deeper emotional connections between characters.","In the story regarding ""a playful afternoon with Holmes and Watson,"" the narrative revolves around a playful exchange about oysters, leading to a physical and affectionate interaction that culminates in a tickling match and declarations of love.",,,,
10,Creativity,"The author creatively reinterprets prompts by blending humor with romance and emotional depth, creating a unique and engaging narrative experience.","In the story regarding ""a playful afternoon with Holmes and Watson,"" the author creatively uses the topic of oysters as a humorous catalyst for a playful and romantic interaction, transforming a mundane conversation into a lively and affectionate scene.",,,,
10,Development (Character and Setting),"The author develops characters through detailed and affectionate interactions, highlighting their emotional depth and mutual affection.","In the story regarding ""a playful afternoon with Holmes and Watson,"" the author portrays Holmes and Watson's relationship through tender gestures, such as Watson caressing Holmes' hair and Holmes kissing Watson's hand, emphasizing their deep emotional bond.",,,,
10,Language Use,"The author employs vivid and descriptive language to create an immersive and intimate atmosphere, enhancing the emotional impact of the narrative.","In the story regarding ""a playful afternoon with Holmes and Watson,"" the author uses descriptive language such as ""Holmes moaned again, angling his head to look his partner in the eye"" and ""Watson smiled against his Holmes’ neck and put there yet another kiss,"" which vividly conveys the intimacy and warmth of their interaction.",,,,
8,Plot,"The author often structures narratives around detailed, methodical processes, emphasizing the practical aspects of the storyline.","In the story regarding ""Sherlock Holmes and Dr. Watson organizing their case files and uncovering memories of love and loss,"" the author describes the meticulous planning and execution of moving their archive, detailing how ""it had taken five trunks filled to the brim and three weeks to ship it all.""",,,,
8,Creativity,"The author tends to reinterpret prompts by focusing on the mundane aspects of life, using them as a backdrop for deeper emotional exploration.","In the story regarding ""Sherlock Holmes and Dr. Watson organizing their case files and uncovering memories of love and loss,"" the author uses the task of organizing their archive as a setting for exploring the relationship between Holmes and Watson, with moments like Holmes dragging Watson down to steal a kiss amidst their work.",,,,
8,Language Use,"The author employs a conversational and informal tone, using dialogue to convey character dynamics and emotional depth.","In the story regarding ""Sherlock Holmes and Dr. Watson organizing their case files and uncovering memories of love and loss,"" the dialogue is casual and intimate, with lines like, ""You scintillate today, my dear fellow! Yet another excellent plan,"" showcasing the warmth and familiarity between the characters.",,,,
