story_id,category,claim,evidence,infer,support,comments
1,Plot,The author structures the plot with a focus on bureaucratic absurdities and the ineffectiveness of the professors' attempts to address their housing issues.,"In the story regarding ""untenured professors dealing with construction chaos and housing issues,"" the narrative includes a series of failed virtual meetings and ineffective communication, such as the contractor's spokesman admitting to never having worked on an occupied building before and the incorrect apartment numbers in e-mail updates.",,,
1,Creativity,"The author employs satire and irony to reinterpret the prompt, highlighting the absurdity of the situation faced by the professors.","In the story regarding ""untenured professors dealing with construction chaos and housing issues,"" the author uses humor, such as the contractor's slide show with typos like ""demonition"" instead of ""demolition,"" and the absurdity of the vice-president's claim that the foundation would naturally rise up against gravity.",,,
1,Development (Character and Setting),"The author develops characters through their interactions and reactions to the chaotic environment, emphasizing their frustrations and helplessness.","In the story regarding ""untenured professors dealing with construction chaos and housing issues,"" characters are portrayed through their responses to the construction chaos, such as the math professor collecting gallons of water and the ethics professor suggesting withholding rent, which highlights their growing desperation.",,,
1,Language Use,"The author uses vivid and humorous language to create a satirical tone, enhancing the narrative's engagement.","In the story regarding ""untenured professors dealing with construction chaos and housing issues,"" the author writes, ""So this is what it must feel like to live inside a tooth that a dentist is trying to drill,"" capturing the overwhelming noise and chaos with a humorous metaphor.",,,
2,Plot,The author structures the narrative around the characters' internal reflections and frustrations rather than external interactions.,"In the story regarding ""a writer and coder's playful rivalry over language,"" the narrative delves into the writer's internal monologue about her struggles with word games and her contemplation of the rules, such as when she questions, ""is the point system for letters really based on frequency, or is it some larger institutional metric of mind control?""",,,
2,Creativity,The author creatively uses metaphors and analogies to explore abstract concepts.,"In the story regarding ""a writer and coder's playful rivalry over language,"" the author uses the metaphor of ""onion"" being an onion, with the ""i"" bisecting it like a core, to illustrate the writer's realization about the word's structure.",,,
2,Development (Character and Setting),"The author develops characters through their distinct approaches to language and logic, highlighting their differences.","In the story regarding ""a writer and coder's playful rivalry over language,"" the writer's frustration with word games is contrasted with the coder's logical approach, as seen when she reflects on his ability to ""guess words with triple letters, like 'fluff,' on the second try.""",,,
2,Language Use,The author employs a conversational and introspective tone to convey the characters' thoughts and interactions.,"In the story regarding ""a writer and coder's playful rivalry over language,"" the tone is conversational and introspective, as seen in the writer's musings, ""A four-letter word for sleeveless garment, today’s crossword demands. But why is it 'tank' and not 'vest'?""",,,
