source,category,claim,example,coherence,groundedness,evidence,comments
5,Plot,"The author often structures narratives around complex, quid pro quo arrangements that drive the plot forward.","In the story of ""a vampire hunter's unexpected alliance,"" the plot revolves around Hesher being offered a home by Salome in exchange for his assistance with her business troubles, creating a dynamic of mutual benefit and tension.",,,,
5,Creativity,"The author tends to blend modern elements with fantasy, creating a unique juxtaposition.","In the story of ""a vampire hunter's unexpected alliance,"" the narrative is set in a contemporary cityscape, with Hesher operating out of a hotel room and later investigating a vape shop, juxtaposed with the supernatural presence of vampires.",,,,
5,Development (Character and Setting),"The author develops characters through their interactions and negotiations, revealing their motivations and complexities.","In the story of ""a vampire hunter's unexpected alliance,"" Hesher's character is developed through his cautious yet pragmatic interactions with Salome, as he navigates the offer of a home in exchange for his services.",,,,
5,Language Use,The author often employs a mix of humor and suspense to maintain engagement and add depth to the narrative.,"In the story of ""a vampire hunter's unexpected alliance,"" the author uses humor in lines like ""You kidnapped me for a blood tasting?"" and suspense in the scene where Hesher investigates the blood trail in the vape shop, creating a balance that keeps the reader intrigued.",,,,
6,Plot,The author often structures narratives around personal interactions and character dynamics rather than broad philosophical discussions.,"In the story regarding ""talking mimics and adventurers,"" the plot centers on a personal encounter between Tamari, Giosi, and the mimic Rakiya, focusing on their immediate reactions and interactions rather than a broader philosophical dialogue about mimic existence.",,,,
6,Creativity,The author tends to creatively reinterpret prompts by integrating elements of surprise and humor into character interactions.,"In the story regarding ""talking mimics and adventurers,"" the author introduces humor through the mimic's transformation from a knight to a chest full of gold, and the subsequent reaction of the shopkeeper Giosi, who almost reaches for the gold before being stopped by Tamari.",,,,
6,Development (Character and Setting),"The author often develops characters through their reactions to unusual situations, creating a sense of depth and relatability.","In the story regarding ""talking mimics and adventurers,"" characters like Tamari and Giosi are developed through their reactions to Rakiya's transformations and the mimic's casual attitude towards its own nature, highlighting their personalities and relationships.",,,,
6,Language Use,The author frequently employs informal and conversational language to create a relatable and engaging narrative tone.,"In the story regarding ""talking mimics and adventurers,"" the dialogue between Tamari, Giosi, and Rakiya is casual and realistic, with lines like ""You'd attack a stranger too if they opened your mouth and stuck their hands in it unwarranted,"" which reveal character perspectives and drive the narrative forward.",,,,
4,Plot,The author often uses dialogue to drive the plot forward and reveal character intentions.,"In the story regarding a professional matchbreaker, the plot unfolds through conversations, such as when Max and Paula discuss the breakup plan, with Max saying, ""You make up, I break up,"" and later, ""Hook, Line, and Sinker.""",,,,
4,Creativity,The author tends to incorporate humor and irony into the narrative to add a layer of complexity.,"In the story regarding a professional matchbreaker, Max's self-awareness as a ""textbook villain"" and his playful demeanor, like when he jokes about payment methods, add a humorous twist to the otherwise serious business of breaking up couples.",,,,
4,Language Use,The author uses concise and direct dialogue to convey character dynamics and plot progression.,"In the story regarding a professional matchbreaker, the dialogue is sharp and to the point, such as when Dora questions Paul with repeated ""Emails?"" to express her growing suspicion and discomfort.",,,,
