story_id,category,claim,example,coherence,grounding,evidence,comments
1,Plot,"The author structures the narrative around a single day, using routine events to gradually reveal underlying tensions.","In the story regarding uncovering hidden truths in a psychiatric hospital, the narrative unfolds over a Saturday morning, starting with breakfast and moving through a community discussion group, highlighting the protagonist's interactions with staff and the subtle changes in routine.",,,,
1,Creativity,The author incorporates a blend of mundane and surreal elements to create a sense of unease.,"In the story regarding uncovering hidden truths in a psychiatric hospital, the author describes a sunny morning with a breakfast surprise of bacon, juxtaposed with the unsettling behavior of Jim, the orderly, whose eyes are bloodshot and movements sluggish, hinting at deeper issues.",,,,
1,Development (Character and Setting),"The author develops characters through their interactions and subtle behavioral cues, creating depth and intrigue.","In the story regarding uncovering hidden truths in a psychiatric hospital, Araceli's long-term status is contrasted with Jim's apparent dissatisfaction and Dr. Janus' worn smile, each character revealing layers through their interactions and the protagonist's observations.",,,,
1,Language Use,The author uses detailed descriptions and dialogue to convey the atmosphere and character dynamics.,"In the story regarding uncovering hidden truths in a psychiatric hospital, the author writes, ""Jim slurred. He followed her at a perfunctory distance... his eyes were watery and bloodshot,"" using vivid language to depict Jim's state and the tension in the environment.",,,,
2,Plot,The author structures the narrative with a focus on character dynamics and internal monologue.,"In the story regarding ""a mysterious amusement park company's expansion,"" the narrative begins with Alcippe's thoughts on punctuality and her internal reactions to Cynthia's chatter, setting the stage for their dynamic before they even arrive at the luncheon.",,,,
2,Creativity,The author incorporates a blend of modern and mythological elements to create a unique narrative atmosphere.,"In the story regarding ""a mysterious amusement park company's expansion,"" the author names the company Brimo Amusements and the protagonist Alcippe, both of which have mythological connotations, adding a layer of intrigue and depth to the otherwise contemporary setting.",,,,
2,Development (Character and Setting),The author develops characters through detailed internal perspectives and interactions.,"In the story regarding ""a mysterious amusement park company's expansion,"" Alcippe's internal monologue reveals her skepticism and annoyance, while Cynthia's dialogue and demeanor are portrayed through Alcippe's perspective, highlighting their contrasting personalities.",,,,
2,Language Use,The author uses vivid and precise language to convey character emotions and settings.,"In the story regarding ""a mysterious amusement park company's expansion,"" phrases like ""plastic smiles and slick presentations"" and ""tittered like a small bird"" effectively convey Alcippe's cynicism and Cynthia's naivety, respectively.",,,,
3,Plot,The author structures the narrative around internal conflict and emotional tension rather than explicit revelations.,"In the story regarding ""unspoken truths at a grandfather's wake,"" the author focuses on Daniel's hesitation and discomfort as he sits in his car, contemplating the wake and his relationship with his grandmother, rather than immediately diving into family secrets.",,,,
3,Creativity,The author employs a blend of introspection and atmospheric detail to reinterpret the prompt.,"In the story regarding ""unspoken truths at a grandfather's wake,"" the author describes Daniel's observations of the funeral home's surroundings and his internal musings, such as the ""gold-green kaleidoscopes on the sidewalk"" and his sardonic thoughts about the embalming process, to create a vivid, introspective atmosphere.",,,,
3,Development (Character and Setting),The author develops characters through subtle interactions and implied emotions.,"In the story regarding ""unspoken truths at a grandfather's wake,"" the author illustrates the strained relationship between Daniel and his grandmother through their initial awkward hug and the ""cold spark"" in her eyes, suggesting unresolved tension without overt confrontation.",,,,
3,Language Use,"The author uses vivid, sensory imagery to enhance the emotional tone.","In the story regarding ""unspoken truths at a grandfather's wake,"" the author describes the funeral home's interior with phrases like ""grandmother-pink wallpaper"" and ""maternal,"" which evoke a sense of nostalgia and discomfort, reflecting Daniel's mixed emotions.",,,,
