source,category,claim,example,coherence,groundedness,evidence,comments
7,Plot,The user emphasizes internal conflict and emotional introspection over external events.,"In the story regarding ""an elf craftsman who sees only light and purity in the being he loves,"" the narrative focuses on Annatar's internal struggle with his identity and the deception he maintains with Celebrimbor, rather than external events or actions.",,,,
7,Plot,The user creates a cyclical narrative structure.,"In the story regarding ""an elf craftsman who sees only light and purity in the being he loves,"" the narrative begins and ends with Annatar's reflection on his dual identity, highlighting the ongoing nature of his internal conflict.",,,,
7,Creativity,The user employs a reinterpretation of established mythological characters.,"In the story regarding ""an elf craftsman who sees only light and purity in the being he loves,"" the characters Annatar and Celebrimbor are drawn from Tolkien's legendarium, adding depth and familiarity to the narrative while exploring new emotional dimensions.",,,,
7,Creativity,The user uses symbolism to enhance thematic depth.,"In the story regarding ""an elf craftsman who sees only light and purity in the being he loves,"" the use of gold and white in Annatar's attire symbolizes purity and light, contrasting with his internal darkness.",,,,
7,Development (Character and Setting),The user develops characters through intimate interactions and emotional depth.,"In the story regarding ""an elf craftsman who sees only light and purity in the being he loves,"" the relationship between Annatar and Celebrimbor is explored through detailed descriptions of their interactions, such as Celebrimbor adorning Annatar with jewelry, which reveals their emotional connection.",,,,
7,Development (Character and Setting),The user creates a setting that reflects the characters' internal states.,"In the story regarding ""an elf craftsman who sees only light and purity in the being he loves,"" the setting of the chambers, filled with light and adorned with gold, mirrors Celebrimbor's perception of Annatar as pure and radiant.",,,,
7,Language Use,"The user employs rich, descriptive language to convey emotional nuance.","In the story regarding ""an elf craftsman who sees only light and purity in the being he loves,"" phrases like ""the robe that Celebrimbor had chosen for him was white, the purest shade of ivory, embroidered with intricate gold thread"" vividly depict the visual and emotional landscape.",,,,
7,Language Use,The user uses dialogue to reveal character motivations and internal conflict.,"In the story regarding ""an elf craftsman who sees only light and purity in the being he loves,"" Annatar's dialogue, such as ""You flatter me too much,"" subtly conveys his awareness of the deception and his internal struggle with his identity.",,,,
