story_id,category,claim,example,coherence,grounding,evidence,comments
1,Plot,The author often structures narratives around personal relationships and their evolution over time.,"In the story of falling in love with an ice man in the South Pole, the narrative follows the protagonist's journey from meeting the ice man, through their marriage, to the eventual emotional and physical distance that grows between them.",,,,
1,Creativity,The author tends to incorporate elements of magical realism to explore complex emotional themes.,"In the story of falling in love with an ice man in the South Pole, the ice man is a literal being made of ice, yet he functions within the story as a metaphor for emotional distance and the unknown aspects of a partner.",,,,
1,Development (Character and Setting),The author develops characters through their interactions and the impact of their environment on their relationship.,"In the story of falling in love with an ice man in the South Pole, the protagonist's relationship with the ice man is deeply affected by their move to the South Pole, which symbolizes a shift in their dynamic and the increasing isolation she feels.",,,,
1,Language Use,The author uses straightforward and descriptive language to convey emotional depth and narrative progression.,"In the story of falling in love with an ice man in the South Pole, the author writes, ""I am lonelier than anyone else in the world,"" directly expressing the protagonist's profound sense of isolation and emotional distance.",,,,
2,Plot,The author often uses a non-linear plot structure that emphasizes introspection over external action.,"In the story regarding ""the story of cooking spaghetti in 1971 and a call from the past,"" the narrative is primarily focused on the protagonist's solitary life and his obsessive spaghetti cooking, with the phone call serving as a brief interruption rather than a catalyst for action.",,,,
2,Creativity,"The author tends to infuse mundane activities with deep symbolic meaning, transforming them into metaphors for broader existential themes.","In the story regarding ""the story of cooking spaghetti in 1971 and a call from the past,"" spaghetti cooking is depicted as a metaphor for loneliness and introspection, with the protagonist reflecting on the act as a form of meditation and a symbol of solitude.",,,,
2,Development (Character and Setting),"The author often develops characters through their internal monologues and reflections, rather than through interactions with others.","In the story regarding ""the story of cooking spaghetti in 1971 and a call from the past,"" the protagonist's character is revealed through his thoughts and feelings about spaghetti and solitude, rather than through dialogue or relationships with other characters.",,,,
2,Language Use,"The author frequently employs vivid, sensory language to create an immersive atmosphere, often using it to reflect the protagonist's emotional state.","In the story regarding ""the story of cooking spaghetti in 1971 and a call from the past,"" the author describes the cooking process with rich sensory details, such as ""fine particles of garlic, onion, and olive oil swirled in the air,"" to evoke the protagonist's deep connection to the ritual of cooking.",,,,
