source,category,claim,example,coherence,groundedness,evidence,comments
2,Plot,The user often structures stories around internal conflicts and introspective narratives rather than external events.,"In the story of cooking spaghetti in 1971 and a call from the past, the narrative revolves around the protagonist's solitary ritual of cooking spaghetti and the internal struggle with the decision to remain uninvolved in the caller's troubles.",,,,
2,Creativity,"The user frequently uses metaphor and symbolism to reinterpret prompts, creating a layered narrative.","In the story of cooking spaghetti in 1971 and a call from the past, spaghetti is used as a metaphor for loneliness and avoidance, with the protagonist imagining cooking as a way to keep the world at bay.",,,,
2,Development (Character and Setting),The user tends to develop characters through their internal monologue and symbolic actions rather than through interactions with others.,"In the story of cooking spaghetti in 1971 and a call from the past, the protagonist's character is revealed through their obsessive cooking habits and reluctance to engage with the caller, highlighting their isolation and introspection.",,,,
2,Language Use,The user often employs poetic and metaphorical language to create a vivid and introspective narrative.,"In the story of cooking spaghetti in 1971 and a call from the past, phrases like ""the phone was like a pillar of ice"" and ""thinking about spaghetti that boils eternally but is never done is a sad, sad thing"" illustrate the protagonist's emotional state and the story's introspective tone.",,,,
1,Creativity,The user creatively blends elements of fantasy with everyday life to explore complex emotional themes.,"In the story regarding ""falling in love with an ice man,"" the ice man works at a cold-storage meat facility, a mundane job that contrasts with his fantastical nature, highlighting the blend of fantasy and reality.",,,,
1,Development (Character and Setting),The user develops characters through their interactions and emotional responses rather than detailed backstories.,"In the story regarding ""falling in love with an ice man,"" the protagonist's relationship with the ice man is developed through their conversations and her emotional journey, rather than through detailed histories of either character.",,,,
1,Language Use,The user employs straightforward and direct language to convey complex emotional states.,"In the story regarding ""falling in love with an ice man,"" phrases like ""I am lonelier than anyone else in the world"" are used to directly express the protagonist's emotional state.",,,,
